{
  "name": "porn",
  "description": "Porn",
  "sources": [
    {
      "url": "https://raw.githubusercontent.com/tiuxo/hosts/master/porn",
      "format": "hosts"
    },
    {
      "url": "https://raw.githubusercontent.com/Clefspeare13/pornhosts/master/0.0.0.0/hosts",
      "format": "hosts"
    },
    {
      "url": "https://raw.githubusercontent.com/mhxion/pornaway/master/hosts/porn_sites.txt",
      "format": "hosts"
    },
    {
      "url": "https://raw.githubusercontent.com/Sinfonietta/hostfiles/master/pornography-hosts",
      "format": "hosts"
    }
  ],
  "exclusions": [
    "*.anonym.to",
    "*.cliqz.com",
    "*.dickssportinggoods.com",
    "*.fastpic.ru",
    "*.findicons.com",
    "*.jwpcdn.com",
    "*.meltwater.com",
    "*.openmultipleurl.com",
    "*.rebrand.ly",
    "*.scansafe.net",
    "*.sucuri.net",
    "*.x-diesel.com",
    "*.zaobao.com.sg",
    "barnfurnituremart.com"
  ],
  "additions": [
    "1.yetuav.top",
    "1.yetuav.xyz",
    "101277.com",
    "18avx.com",
    "1upsexer.com",
    "224gui.com",
    "56xx.top",
    "582898.com",
    "69hbook.com",
    "6z9.cc",
    "7xiu.cc",
    "8mk.cc",
    "adultdvdtalk.com",
    "adultdvdtalk.com",
    "adultfriendfinder.com",
    "adultgle.com",
    "agkywg.com",
    "avwong.com",
    "babes.com",
    "babestare.com",
    "bestporn.su",
    "canovel.com",
    "clipsbai.com",
    "crazyvideo.cyou",
    "dirtyindianporn.info",
    "doublelist.com",
    "dudu-sex.com",
    "fadama.com",
    "fanqianglu.com",
    "femefun.com",
    "fuckbooknigeria.com",
    "fuckbookzambia.com",
    "hairyolder.com",
    "hanime1.me",
    "heatedaffairs.com",
    "hlsapp.cc",
    "hlsdhoio.com",
    "hlsfrqug.com",
    "hlshowpq.show",
    "hlslhotf.com",
    "hlsqugfz.com",
    "hot-datings.life",
    "hotgaylist.com",
    "hotmovies.com",
    "hotsex.blog",
    "hotsex.cz",
    "hotzxgirl.com",
    "ijavhd.com",
    "jiatingseqing.com",
    "justindianpornx.com",
    "m.3movs.com",
    "myxxgirl.com",
    "nudegirls.wiki",
    "onlyindian.org",
    "peeperz.com",
    "pfbat.fit",
    "playboytv.com",
    "porn00.tv",
    "porn7.net",
    "pornbomb.cc",
    "pornhub-teen.com",
    "pornhub-x.net",
    "pornhub.run",
    "porniq.com",
    "pornone.com",
    "pornstar.gallery",
    "pornvideo.rodeo",
    "prettyvirgin.com",
    "qinav.com",
    "qinav.xyz",
    "qingse.one",
    "redbled.com",
    "rouav.com",
    "sextube.com",
    "sis001.com",
    "siszdaiy.com",
    "skipthegames.com",
    "sqhl68.com",
    "studentseemevery.buzz",
    "t66y.com",
    "uxzina.fit",
    "vsexy.lol",
    "wargers.org",
    "whichav.video",
    "whynotbi.com",
    "www.adultdvdtalk.com",
    "www.freeextremewebcams.com",
    "www.hotmovies.com",
    "www.instaboink.com",
    "www.pornstarpic.net",
    "www.redbled.com",
    "www.t66y.com",
    "wwwxvideo.org",
    "x-videos.me",
    "x-videos.ru",
    "xbookcn.net",
    "xinbochegn.com",
    "xporno.pics",
    "xteen.vip",
    "xvideo.bid",
    "xvideo.blue",
    "xvideo.party",
    "xvideo.run",
    "xvideos.co",
    "xvideos.es",
    "xxxdessert.com",
    "xxxvid.college",
    "xxxwow.net",
    "y1p.cc",
    "ychidd.com",
    "yetuav.top",
    "yetuav.xyz",
    "yetujs-baidu.com",
    "yetusp.com",
    "youporner.net"
  ]
}
